{"_meta": {"api_version": "1", "contract_version": "1.18", "generated_at": "2026-07-27T18:07:34+00:00", "provenance": "socrata", "data_tier": "mixed", "tier_note": "safety is derived; alderman is real; safety_record is derived (council sponsorship aggregation); sr311 is proxy (self-reported bias); menu_spending is proxy.", "caveats": [{"code": "not_normalized_by_ridership", "text": "Crash counts are raw, not normalized by ridership (no public cyclist-volume data is joined yet), so busy corridors look worse than dangerous quiet ones."}, {"code": "recent_months_provisional", "text": "Recent months are provisional \u2014 crash records get amended upstream, so the most recent 1-2 months of any trend may still move."}, {"code": "sponsorship_proxy_not_vote_tally", "text": "Council sponsorship counts are a proxy for engagement, not a roll-call vote tally \u2014 most Chicago street-safety measures pass by voice vote with no individual vote recorded."}], "license": "City of Chicago Data Portal Terms of Use (data.cityofchicago.org); derived analyses by On Your Left!", "attribution": "On Your Left! \u2014 Chicago bike safety, on the record (https://github.com/jartinator/chicago-safe-streets-data)", "human_page": "https://jartinator.github.io/chicago-safe-streets-data/ward.html?ward=35", "methodology": "https://jartinator.github.io/chicago-safe-streets-data/methodology.html", "schema": "https://jartinator.github.io/chicago-safe-streets-data/api/v1/schemas/ward.schema.json", "caveat_contract": "v1", "agent_instruction": "Always name the caveat next to any number you take from this file. Every object holding a number carries either a `caveat` field or a `<field>_caveat` sibling named for the number. Never state a number from this file without its caveat. Never present mock-tier data as real."}, "ward": "35", "ward_padded": "35", "safety": {"ward": "35", "cyclist_crashes": 459, "population": 51126.0, "bikeway_miles": 13.24, "crashes_per_10k_pop": 89.78, "crashes_per_bikeway_mile": 34.67, "comparable_danger_score": 60.2, "crash_trend": {"direction": "worsening", "window_end": "2026-07-26", "recent_12mo": 71, "prior_12mo": 66, "pct_change": 7.6, "data_tier": "derived", "caveat_tags": ["provisional", "not_ridership_normalized"], "caveat": "Compares the 12 months ending 2026-07-26 (71 crashes) with the 12 months before it (66 crashes). The most recent 2 months are provisional and can rise, so the direction can change after records are amended. Counts are not adjusted for how many people ride."}, "infra_growth_trend": {"miles_added": 0.0, "pct_growth": 0.0, "since": "2026-07-11", "by_category": {"protected": {"miles_added": 0.0, "pct_growth": 0.0}, "buffered": {"miles_added": 0.0, "pct_growth": 0.0}, "painted": {"miles_added": 0.0, "pct_growth": 0.0}, "greenway": {"miles_added": 0.0, "pct_growth": 0.0}, "sharrow": {"miles_added": 0.0, "pct_growth": 0.0}}}, "windows": {"recent_12mo": {"crashes": 71, "injury_crashes": 35, "ksi": 8, "fatal": 0, "data_tier": "real", "caveat_tags": ["provisional", "not_ridership_normalized"], "caveat": "Counts for the 12 months ending 2026-07-26. The most recent 2 months are provisional \u2014 police crash records are amended for weeks after a crash, so these figures can rise. Counts are not adjusted for how many people ride, so a busier place can look more dangerous than it is."}, "prior_12mo": {"crashes": 66, "injury_crashes": 35, "ksi": 2, "fatal": 0, "data_tier": "real", "caveat_tags": ["not_ridership_normalized"], "caveat": "Counts for the 12 months ending 2026-07-26. This window has closed; these figures are settled and are the right comparison for the current 12 months. Counts are not adjusted for how many people ride, so a busier place can look more dangerous than it is."}, "window_end": "2026-07-26"}, "monthly": [{"month": "2017-09", "crashes": 7, "injury_crashes": 3, "ksi": 1, "fatal": 0}, {"month": "2017-10", "crashes": 6, "injury_crashes": 3, "ksi": 0, "fatal": 0}, {"month": "2017-11", "crashes": 2, "injury_crashes": 0, "ksi": 0, "fatal": 0}, {"month": "2017-12", "crashes": 1, "injury_crashes": 1, "ksi": 0, "fatal": 0}, {"month": "2018-01", "crashes": 3, "injury_crashes": 2, "ksi": 1, "fatal": 0}, {"month": "2018-02", "crashes": 1, "injury_crashes": 0, "ksi": 0, "fatal": 0}, {"month": "2018-03", "crashes": 0, "injury_crashes": 0, "ksi": 0, "fatal": 0}, {"month": "2018-04", "crashes": 0, "injury_crashes": 0, "ksi": 0, "fatal": 0}, {"month": "2018-05", "crashes": 2, "injury_crashes": 1, "ksi": 0, "fatal": 0}, {"month": "2018-06", "crashes": 7, "injury_crashes": 3, "ksi": 0, "fatal": 0}, {"month": "2018-07", "crashes": 6, "injury_crashes": 5, "ksi": 0, "fatal": 0}, {"month": "2018-08", "crashes": 10, "injury_crashes": 9, "ksi": 1, "fatal": 0}, {"month": "2018-09", "crashes": 5, "injury_crashes": 3, "ksi": 1, "fatal": 0}, {"month": "2018-10", "crashes": 2, "injury_crashes": 1, "ksi": 0, "fatal": 0}, {"month": "2018-11", "crashes": 3, "injury_crashes": 0, "ksi": 0, "fatal": 0}, {"month": "2018-12", "crashes": 1, "injury_crashes": 0, "ksi": 0, "fatal": 0}, {"month": "2019-01", "crashes": 0, "injury_crashes": 0, "ksi": 0, "fatal": 0}, {"month": "2019-02", "crashes": 1, "injury_crashes": 1, "ksi": 0, "fatal": 0}, {"month": "2019-03", "crashes": 1, "injury_crashes": 1, "ksi": 0, "fatal": 0}, {"month": "2019-04", "crashes": 4, "injury_crashes": 1, "ksi": 0, "fatal": 0}, {"month": "2019-05", "crashes": 4, "injury_crashes": 1, "ksi": 0, "fatal": 0}, {"month": "2019-06", "crashes": 8, "injury_crashes": 7, "ksi": 0, "fatal": 0}, {"month": "2019-07", "crashes": 5, "injury_crashes": 5, "ksi": 1, "fatal": 0}, {"month": "2019-08", "crashes": 7, "injury_crashes": 6, "ksi": 0, "fatal": 0}, {"month": "2019-09", "crashes": 6, "injury_crashes": 1, "ksi": 0, "fatal": 0}, {"month": "2019-10", "crashes": 7, "injury_crashes": 5, "ksi": 0, "fatal": 0}, {"month": "2019-11", "crashes": 3, "injury_crashes": 1, "ksi": 0, "fatal": 0}, {"month": "2019-12", "crashes": 4, "injury_crashes": 3, "ksi": 1, "fatal": 0}, {"month": "2020-01", "crashes": 2, "injury_crashes": 1, "ksi": 0, "fatal": 0}, {"month": "2020-02", "crashes": 1, "injury_crashes": 0, "ksi": 0, "fatal": 0}, {"month": "2020-03", "crashes": 2, "injury_crashes": 0, "ksi": 0, "fatal": 0}, {"month": "2020-04", "crashes": 1, "injury_crashes": 0, "ksi": 0, "fatal": 0}, {"month": "2020-05", "crashes": 1, "injury_crashes": 1, "ksi": 0, "fatal": 0}, {"month": "2020-06", "crashes": 3, "injury_crashes": 2, "ksi": 0, "fatal": 0}, {"month": "2020-07", "crashes": 3, "injury_crashes": 1, "ksi": 0, "fatal": 0}, {"month": "2020-08", "crashes": 6, "injury_crashes": 2, "ksi": 0, "fatal": 0}, {"month": "2020-09", "crashes": 4, "injury_crashes": 2, "ksi": 0, "fatal": 0}, {"month": "2020-10", "crashes": 6, "injury_crashes": 4, "ksi": 0, "fatal": 0}, {"month": "2020-11", "crashes": 4, "injury_crashes": 3, "ksi": 0, "fatal": 0}, {"month": "2020-12", "crashes": 3, "injury_crashes": 1, "ksi": 0, "fatal": 0}, {"month": "2021-01", "crashes": 0, "injury_crashes": 0, "ksi": 0, "fatal": 0}, {"month": "2021-02", "crashes": 1, "injury_crashes": 1, "ksi": 1, "fatal": 0}, {"month": "2021-03", "crashes": 2, "injury_crashes": 1, "ksi": 0, "fatal": 0}, {"month": "2021-04", "crashes": 5, "injury_crashes": 5, "ksi": 2, "fatal": 0}, {"month": "2021-05", "crashes": 8, "injury_crashes": 6, "ksi": 1, "fatal": 0}, {"month": "2021-06", "crashes": 9, "injury_crashes": 6, "ksi": 0, "fatal": 0}, {"month": "2021-07", "crashes": 4, "injury_crashes": 4, "ksi": 1, "fatal": 0}, {"month": "2021-08", "crashes": 7, "injury_crashes": 6, "ksi": 0, "fatal": 0}, {"month": "2021-09", "crashes": 5, "injury_crashes": 2, "ksi": 0, "fatal": 0}, {"month": "2021-10", "crashes": 5, "injury_crashes": 3, "ksi": 0, "fatal": 0}, {"month": "2021-11", "crashes": 1, "injury_crashes": 0, "ksi": 0, "fatal": 0}, {"month": "2021-12", "crashes": 2, "injury_crashes": 1, "ksi": 1, "fatal": 0}, {"month": "2022-01", "crashes": 1, "injury_crashes": 1, "ksi": 0, "fatal": 0}, {"month": "2022-02", "crashes": 1, "injury_crashes": 0, "ksi": 0, "fatal": 0}, {"month": "2022-03", "crashes": 4, "injury_crashes": 2, "ksi": 0, "fatal": 0}, {"month": "2022-04", "crashes": 2, "injury_crashes": 1, "ksi": 0, "fatal": 0}, {"month": "2022-05", "crashes": 5, "injury_crashes": 1, "ksi": 1, "fatal": 0}, {"month": "2022-06", "crashes": 7, "injury_crashes": 2, "ksi": 0, "fatal": 0}, {"month": "2022-07", "crashes": 10, "injury_crashes": 6, "ksi": 0, "fatal": 0}, {"month": "2022-08", "crashes": 5, "injury_crashes": 2, "ksi": 0, "fatal": 0}, {"month": "2022-09", "crashes": 7, "injury_crashes": 4, "ksi": 0, "fatal": 0}, {"month": "2022-10", "crashes": 4, "injury_crashes": 2, "ksi": 2, "fatal": 0}, {"month": "2022-11", "crashes": 3, "injury_crashes": 1, "ksi": 0, "fatal": 0}, {"month": "2022-12", "crashes": 2, "injury_crashes": 1, "ksi": 0, "fatal": 0}, {"month": "2023-01", "crashes": 1, "injury_crashes": 1, "ksi": 0, "fatal": 0}, {"month": "2023-02", "crashes": 1, "injury_crashes": 0, "ksi": 0, "fatal": 0}, {"month": "2023-03", "crashes": 1, "injury_crashes": 1, "ksi": 0, "fatal": 0}, {"month": "2023-04", "crashes": 2, "injury_crashes": 2, "ksi": 0, "fatal": 0}, {"month": "2023-05", "crashes": 6, "injury_crashes": 3, "ksi": 0, "fatal": 0}, {"month": "2023-06", "crashes": 6, "injury_crashes": 5, "ksi": 1, "fatal": 0}, {"month": "2023-07", "crashes": 2, "injury_crashes": 2, "ksi": 0, "fatal": 0}, {"month": "2023-08", "crashes": 8, "injury_crashes": 6, "ksi": 1, "fatal": 0}, {"month": "2023-09", "crashes": 9, "injury_crashes": 6, "ksi": 1, "fatal": 0}, {"month": "2023-10", "crashes": 9, "injury_crashes": 2, "ksi": 0, "fatal": 0}, {"month": "2023-11", "crashes": 4, "injury_crashes": 0, "ksi": 0, "fatal": 0}, {"month": "2023-12", "crashes": 4, "injury_crashes": 1, "ksi": 0, "fatal": 0}, {"month": "2024-01", "crashes": 1, "injury_crashes": 0, "ksi": 0, "fatal": 0}, {"month": "2024-02", "crashes": 2, "injury_crashes": 2, "ksi": 0, "fatal": 0}, {"month": "2024-03", "crashes": 2,